{
  "schema_version": 1,
  "record_type": "evidence",
  "evidence_id": "E.FUNCTION_FIRST.PROJECT_SPECIFIC_CAPTURE_OWNER_LIVE_PROBE.20260927T213948Z",
  "evidence_type": "solidworks_observation",
  "evidence_state": "VERIFIED",
  "source_authority": "SOLIDWORKS_LIVE_STATE",
  "source_classification": "verified_from_solidworks_api",
  "subject": {
    "subject_type": "function_first_project_specific_capture_owner_binding_probe",
    "identity_exact": "BENCH_BOTTLE_D48_H180-2; FITCHECK_DRIVEN_WRAP_BELT_5x160x93_V25-1; FITCHECK_WRAP_SUPPORT_ROLLER_D30_H93_V25-1/-2; FITCHECK_PRISM_REACTION_BASE_70x120x20_V43-1; FITCHECK_PRISM_GUIDE_RAIL_100x10x10_V43-1/-2; FITCHECK_PRISM_CARRIER_SLIDER_15x80x60_V43-1; FITCHECK_PRISM_ACTUATOR_ENVELOPE_45x35x35_V43-1; FITCHECK_PRISM_LINK_15x10x25_V43-1/-2; FITCHECK_PRISM_ARM1_33p0824x10x5_V43-1; FITCHECK_PRISM_ARM2_18p6806x10x5_V43-1; FITCHECK_INDEX_STOP_FINGER_54p25x6x20_V37-1/-2; 6130648 AL and 6130649 AR carriage references",
    "document_title_exact": "IXOR_Benchmark_v43_PRISM_OPERATING_CANDIDATE_PORTABLE",
    "document_path_exact": "C:\\ChatGPT\\Solidworks\\IXOR\\CAB_IXOR_6130800\\IXOR_Benchmark_v43_PRISM_OPERATING_CANDIDATE_PORTABLE.SLDASM"
  },
  "provenance": {
    "recorded_at": "2026-09-27T21:39:48Z",
    "source_ref": "Fresh live SOLIDWORKS reads: sw_status; sw_query_components(top_level_only=true); read-only mate probe source SHA256 8b3612e248e267b3f98b9495c94d92d79fc8c193547a901f8ebc3aac270d4f8c; read-only broad top-level scan source SHA256 091bd7982fc6c73d1660e46865896d331d40e3643a962f9d78cb5a0e2a0233e6; read-only full nested inventory scan source SHA256 22e9a48c091d1d23a2b76376c8631cc11ec9acf075a0008edc5ea01ec0249f9a.",
    "tool_path": "sw_status -> sw_query_components -> sw_execute_code(read-only mate probe) -> sw_execute_code(read-only top-level scan) -> sw_execute_code(read-only full nested scan)"
  },
  "dependencies": [
    "E.FUNCTION_FIRST.CONTACT_MAINTENANCE_SOURCE_PROBE.20260927T150842223Z",
    "E.FUNCTION_FIRST.MECHANISM_REFERENCE_SOURCE_BOUNDARY.20260927T212442Z",
    "PLAN-0010"
  ],
  "geometry_state": "CANDIDATE_OPERATING",
  "temporal_scope": {
    "coverage": "POINT_ONLY",
    "validity_state": "CURRENT",
    "state_ids": [],
    "transition_ids": []
  },
  "ambiguity_bucket": "OEM_SOURCE_REQUIRED",
  "mechanical_acceptance_granted": false,
  "payload": {
    "observation_kind": "project_specific_capture_owner_binding_probe",
    "document": {
      "title": "IXOR_Benchmark_v43_PRISM_OPERATING_CANDIDATE_PORTABLE",
      "path": "C:\\ChatGPT\\Solidworks\\IXOR\\CAB_IXOR_6130800\\IXOR_Benchmark_v43_PRISM_OPERATING_CANDIDATE_PORTABLE.SLDASM",
      "active_configuration_exact": "V43_WRAP"
    },
    "full_component_inventory_count": 64,
    "top_level_component_count": 58,
    "zero_incident_mate_targets": [
      "BENCH_BOTTLE_D48_H180-2",
      "FITCHECK_DRIVEN_WRAP_BELT_5x160x93_V25-1",
      "FITCHECK_WRAP_SUPPORT_ROLLER_D30_H93_V25-1",
      "FITCHECK_WRAP_SUPPORT_ROLLER_D30_H93_V25-2",
      "FITCHECK_PRISM_REACTION_BASE_70x120x20_V43-1",
      "FITCHECK_PRISM_GUIDE_RAIL_100x10x10_V43-1",
      "FITCHECK_PRISM_GUIDE_RAIL_100x10x10_V43-2",
      "FITCHECK_PRISM_CARRIER_SLIDER_15x80x60_V43-1",
      "FITCHECK_PRISM_ACTUATOR_ENVELOPE_45x35x35_V43-1",
      "FITCHECK_PRISM_LINK_15x10x25_V43-1",
      "FITCHECK_PRISM_LINK_15x10x25_V43-2",
      "FITCHECK_PRISM_ARM1_33p0824x10x5_V43-1",
      "FITCHECK_PRISM_ARM2_18p6806x10x5_V43-1",
      "FITCHECK_INDEX_STOP_FINGER_54p25x6x20_V37-1",
      "FITCHECK_INDEX_STOP_FINGER_54p25x6x20_V37-2"
    ],
    "nested_name_scan": {
      "spring_or_spring_synonym_matches": [],
      "pneumatic_or_cylinder_matches": [],
      "actuator_matches": [
        "FITCHECK_PRISM_ACTUATOR_ENVELOPE_45x35x35_V43-1"
      ],
      "carriage_matches": [
        "6130648_01_Carriage_Schlitten_AL_NATIVE_PORTABLE_V22-1",
        "6130649_01_Carriage_Schlitten_AR_NATIVE_PORTABLE_V20-1"
      ],
      "note": "The floor-stand virtual component Name2 strings inherit the parent assembly title containing PRISM and are not interpreted as prism mechanism identity."
    },
    "carriage_reference_state": [
      {
        "name2": "6130648_01_Carriage_Schlitten_AL_NATIVE_PORTABLE_V22-1",
        "incident_active_assembly_mate_count": 0,
        "translation_mm": [
          650,
          500,
          1500
        ]
      },
      {
        "name2": "6130649_01_Carriage_Schlitten_AR_NATIVE_PORTABLE_V20-1",
        "incident_active_assembly_mate_count": 0,
        "translation_mm": [
          500,
          500,
          1500
        ]
      }
    ],
    "related_reference_transform": {
      "name2": "6130460_03_AR60_NATIVE_PORTABLE_V18-2",
      "translation_mm": [
        484.7308852396768,
        527.8630980015928,
        1512.441354942933
      ],
      "note": "Transform recorded by fresh sw_query_components; no ownership or contact relationship is inferred from presence."
    },
    "admitted_claims": [
      "The active document is IXOR_Benchmark_v43_PRISM_OPERATING_CANDIDATE_PORTABLE in configuration V43_WRAP with 64 components in the full nested inventory at the recorded point.",
      "Each of the fifteen exact bottle-handling fit-check targets listed in zero_incident_mate_targets has zero incident active-assembly mates at the recorded point.",
      "The full nested component-name scan found no spring/feder name match and no pneumatic/cylinder/zylinder name match; the only actuator-name match is FITCHECK_PRISM_ACTUATOR_ENVELOPE_45x35x35_V43-1, which has zero incident active-assembly mates.",
      "The exact AL and AR carriage references are present but have zero incident active-assembly mates and are parked at the recorded transforms rather than being bound into the bottle-handling fit-check chain.",
      "The current active V43_WRAP assembly therefore does not bind a project-specific physical capture owner, closure/release mate chain, actuator, spring/compliance owner, or motion law for the bottle-handling contact set."
    ],
    "explicitly_not_claimed": [
      "The absence of a bound owner in the active assembly does not prove that no project-specific integrator drawing, PLC sequence, external mechanism, or OEM application specification exists elsewhere.",
      "Name-based absence does not prove that an unnamed or external spring, cylinder, actuator, or compliant element cannot exist.",
      "This observation does not rank or select a translating carrier, pivoting carrier, moving belt, compliant-preload architecture, or the retained V43 Prism candidate.",
      "This observation does not establish stroke, limits, preload, force, stiffness, friction, traction, reaction capacity, release behavior, reachable-state clearance, interval-wide contact maintenance, or mechanical acceptance."
    ],
    "selection_status": "NOT_SELECTED"
  }
}
